Title,Director,Cast,Genre,comb
police sisters,Vikki,"Roja, Raasi, Sridhar, Brahmanandam",Action,"Vikki Roja, Raasi, Sridhar, Brahmanandam Action"
pilisthe palukutha,Kodi Ramakrishna,"Jai Akash, Shamita Shetty",Romance,"Kodi Ramakrishna Jai Akash, Shamita Shetty Romance"
dhanalakshmi i love you,Siva Nageswara Rao,"Allari Naresh, Aditya Om, Ankitha",Romance,"Siva Nageswara Rao Allari Naresh, Aditya Om, Ankitha Romance"
gemeni,unknown,"Venkatesh, Namitha, Mumtaj",Action,"unknown Venkatesh, Namitha, Mumtaj Action"
nuvve nuvve,Trivikram Srinivas,"Tarun, Shriya Saran, Prakash Raj",Romance,"Trivikram Srinivas Tarun, Shriya Saran, Prakash Raj Romance"
prema donga,Ramana,"Srihari, Soundarya, Vinod",Action,"Ramana Srihari, Soundarya, Vinod Action"
hrudayanjali,A. Raghurami Reddy,"Sanjay Mitra, Girija Shettar",Romance,"A. Raghurami Reddy Sanjay Mitra, Girija Shettar Romance"
sandade sandadi,Muppalaneni Siva,"Rajendra Prasad, Jagapathi Babu, Raasi",Comedy,"Muppalaneni Siva Rajendra Prasad, Jagapathi Babu, Raasi Comedy"
adrustam,Sekhar Suri,"Tarun, Gajala, Reemma Sen, Asha Saini",Romance,"Sekhar Suri Tarun, Gajala, Reemma Sen, Asha Saini Romance"
naga pratista,unknown,"Raasi, Sreejith",Drama,"unknown Raasi, Sreejith Drama"
neetho cheppalani,B. Satya Naidu,"Akash, Anupriya, M. S. Narayana",Romance,"B. Satya Naidu Akash, Anupriya, M. S. Narayana Romance"
parasuram,unknown,"Srihari, Sanghavi",Action,"unknown Srihari, Sanghavi Action"
nee premakai,Muppulaneni Siva,"Vineeth, Abbas, Laya, Sonia Agarwal",Romance,"Muppulaneni Siva Vineeth, Abbas, Laya, Sonia Agarwal Romance"
seshu,Jeevitha Rajashekar,"Rajasekhar, Kalyani, Nassar",Action,"Jeevitha Rajashekar Rajasekhar, Kalyani, Nassar Action"
lagna patrika,Subburaju,"Babloo Prithviraj, Sanghavi, Brahmanandam, Phaniraj Kumar",Romance,"Subburaju Babloo Prithviraj, Sanghavi, Brahmanandam, Phaniraj Kumar Romance"
ramana,Siva Nageswara Rao,"Rajendra Prasad, Mahi, Brahmanandam, Tanikella Bharani",Action / Comedy,"Siva Nageswara Rao Rajendra Prasad, Mahi, Brahmanandam, Tanikella Bharani Action / Comedy"
action no. 1,unknown,"Ram, Lakshman, Thriller Manju",Action,"unknown Ram, Lakshman, Thriller Manju Action"
chandravamsam,J. K. Bharavi,"Krishna Ghattamaneni, Jaya Pradha, Sivaji, Rohith",Drama,"J. K. Bharavi Krishna Ghattamaneni, Jaya Pradha, Sivaji, Rohith Drama"
nenu ninnu premistunnanu,G. Haribabu,"Prasanna, Keerthi Shaheen, Amrutha, Ahuti Prasad",Romance,"G. Haribabu Prasanna, Keerthi Shaheen, Amrutha, Ahuti Prasad Romance"
kondaveeti simhasanam,Dasari Narayana Rao,"Mohan Babu, Soundarya, Udaya Bhanu",Action,"Dasari Narayana Rao Mohan Babu, Soundarya, Udaya Bhanu Action"
kalusukovalani,Raghu Raj,"Uday Kiran, Gajala, Pratyusha",Romance,"Raghu Raj Uday Kiran, Gajala, Pratyusha Romance"
raghava,Y. Nageswara Rao,"Suresh, Rajasri, Kota Srinivasa Rao, Brahmanandam",Drama,"Y. Nageswara Rao Suresh, Rajasri, Kota Srinivasa Rao, Brahmanandam Drama"
neethone vuntanu,T. Prabhakar,"Upendra, Sanghavi, Rachana Banerjee",Romance,"T. Prabhakar Upendra, Sanghavi, Rachana Banerjee Romance"
o chinnadana,E. Sathibabu,"Srikanth, Raja, Gajala, Asha Saini, Shruthi Raj",Comedy,"E. Sathibabu Srikanth, Raja, Gajala, Asha Saini, Shruthi Raj Comedy"
priya nestama,R. Ganapathy,"Venu, Malavika, Shama",Romance,"R. Ganapathy Venu, Malavika, Shama Romance"
nuvvu leka nenu lenu,Kashi Vishwanath,"Tarun, Aarthi Agarwal, Laya, Sarath Babu",Romance,"Kashi Vishwanath Tarun, Aarthi Agarwal, Laya, Sarath Babu Romance"
takkari donga,Jayanth C. Paranjee,"Mahesh Babu, Lisa Ray, Bipasha Basu, Krishna Ghattamaneni",Action,"Jayanth C. Paranjee Mahesh Babu, Lisa Ray, Bipasha Basu, Krishna Ghattamaneni Action"
seema simham,G. Ram Prasad,"Nandamuri Balakrishna, Simran, Reemma Sen, P. Vasu",Action,"G. Ram Prasad Nandamuri Balakrishna, Simran, Reemma Sen, P. Vasu Action"
mee kosam,V. Janardhan,"Ramyasri, Samaram, Sharmila",Documentary,"V. Janardhan Ramyasri, Samaram, Sharmila Documentary"
nuvvunte chaalu,Achyuth Reddy,"Adarsha, Sonali Raj",Romance,"Achyuth Reddy Adarsha, Sonali Raj Romance"
premaku swagatam,S. V. Krishna Reddy,"J. D. Chakravarthy, Soundarya",Romance,"S. V. Krishna Reddy J. D. Chakravarthy, Soundarya Romance"
chelia chelia chiru kopama,Sai Shyam,"Nivas, Shikha Sinha",Romance,"Sai Shyam Nivas, Shikha Sinha Romance"
entha bagundo,Bharadwaja Thammareddy,"Sai Kiran, Rohith, Laya",Romance,"Bharadwaja Thammareddy Sai Kiran, Rohith, Laya Romance"
devi nagamma,Alahari,"Prema, Baby Deepika, Jackie, Mani Chandana, Mada, Somayajulu, Jeeva",Drama,"Alahari Prema, Baby Deepika, Jackie, Mani Chandana, Mada, Somayajulu, Jeeva Drama"
vooru manadiraa,R. Narayana Murthy,"R. Narayana Murthy, Siddappa Naidu",Drama,"R. Narayana Murthy R. Narayana Murthy, Siddappa Naidu Drama"
hai,E. V. V. Satyanarayana,"Aryan Rajesh, Nikita Thukral",Romance,"E. V. V. Satyanarayana Aryan Rajesh, Nikita Thukral Romance"
sahasa baludu vichitra kothi,Dasharatha Raju,"Vijayashanti, Brahmanandam, Sarath Babu, Sudha",Adventure,"Dasharatha Raju Vijayashanti, Brahmanandam, Sarath Babu, Sudha Adventure"
manasutho,Ravi Kumar Chowdary,"Aakash, Arjoo Govithrikar, Khayyam",Romance,"Ravi Kumar Chowdary Aakash, Arjoo Govithrikar, Khayyam Romance"
allari,Ravi Babu,"Naresh, Anuradha Mehta",Comedy,"Ravi Babu Naresh, Anuradha Mehta Comedy"
santosham,Dasaradh,"Akkineni Nagarjuna, Gracy Singh, Prabhu Deva, Shriya Saran",Drama,"Dasaradh Akkineni Nagarjuna, Gracy Singh, Prabhu Deva, Shriya Saran Drama"
vendi mabbulu,Raviraja Pinisetty,"Balayya, Pulakit, Anil, Mona Chopra, Meghana Naidu, Mitika",Romance,"Raviraja Pinisetty Balayya, Pulakit, Anil, Mona Chopra, Meghana Naidu, Mitika Romance"
lahiri lahiri lahirilo,Y. V. S. Chowdary,"Nandamuri Harikrishna, Bhanupriya, Rachana Banerjee, Ankitha",Drama,"Y. V. S. Chowdary Nandamuri Harikrishna, Bhanupriya, Rachana Banerjee, Ankitha Drama"
jayam,Teja,"Nitin, Sadha, Tottempudi Gopichand",Action / Romance,"Teja Nitin, Sadha, Tottempudi Gopichand Action / Romance"
manasunte chaalu,Jonnalagadda Srinivasa Rao,"Sai Kiran, Sivaji, Jennifer Kotwal",Romance,"Jonnalagadda Srinivasa Rao Sai Kiran, Sivaji, Jennifer Kotwal Romance"
mounamelanoyi,Shyam Prasad,"Sachin, Sampadha, Chalapathi Rao",Romance,"Shyam Prasad Sachin, Sampadha, Chalapathi Rao Romance"
nee thodu kavali,Bheemaneni Srinivas Rao,"Deepak, Charmy Kaur, Rimi Sen",Romance,"Bheemaneni Srinivas Rao Deepak, Charmy Kaur, Rimi Sen Romance"
vasu,A. Karunakaran,"Venkatesh, Bhoomika Chawla",Romance,"A. Karunakaran Venkatesh, Bhoomika Chawla Romance"
priyadarshini,Dhavala Mallik,"Surya Vamsi, Sunitha Varma, Brahmanandam",Drama,"Dhavala Mallik Surya Vamsi, Sunitha Varma, Brahmanandam Drama"
aaduthu paaduthu,Devi Prasad,"Srikanth, Sunil, Gayatri Jayaraman",Romance,"Devi Prasad Srikanth, Sunil, Gayatri Jayaraman Romance"
bejawada police station,Chimakurthi Hari Babu,"Keshav, Shilpa Shivanand, Brahmaji, Ali, Chinna",Drama,"Chimakurthi Hari Babu Keshav, Shilpa Shivanand, Brahmaji, Ali, Chinna Drama"
friends,unknown,"Sivaji, Ali",Comedy,"unknown Sivaji, Ali Comedy"
narahari,Thriller Manju,"Sai Kumar, Thriller Manju, Sreedevi",Action,"Thriller Manju Sai Kumar, Thriller Manju, Sreedevi Action"
aadi,V. V. Vinayak,"Jr. NTR, Keerthi Chawla",Action,"V. V. Vinayak Jr. NTR, Keerthi Chawla Action"
tagore,V. V. Vinayak,"Chiranjeevi, Jyothika, Shriya Saran",Action / Drama,"V. V. Vinayak Chiranjeevi, Jyothika, Shriya Saran Action / Drama"
aadanthe ado type,E. V. V. Satyanarayana,"Sivaji, Aryan Rajesh, Bhoomika Chawla, Anitha Hassandhani",Comedy,"E. V. V. Satyanarayana Sivaji, Aryan Rajesh, Bhoomika Chawla, Anitha Hassandhani Comedy"
okato number kurradu,A. Kodandarami Reddy,"Nandamuri Taraka Ratna, Rekha Vedavyas, Brahmanandam",Action / Romance,"A. Kodandarami Reddy Nandamuri Taraka Ratna, Rekha Vedavyas, Brahmanandam Action / Romance"
pellamtho panenti,S. V. Krishna Reddy,"Venu Thottempudi, Laya, Kalyani",Comedy,"S. V. Krishna Reddy Venu Thottempudi, Laya, Kalyani Comedy"
janaki weds sriram,Anji,"Rohith, Gajala, Rekha Vedavyas",Romance,"Anji Rohith, Gajala, Rekha Vedavyas Romance"
oka radha iddaru krishnula pelli,G. Nageswara Reddy,"Srikanth, Prabhu Deva, Namitha, Tanikella Bharani, Chandra Mohan",Comedy,"G. Nageswara Reddy Srikanth, Prabhu Deva, Namitha, Tanikella Bharani, Chandra Mohan Comedy"
vishnu,Shaji Kailas,"Vishnu Manchu, Vedhika, Neetu Chandra",Action / Romance,"Shaji Kailas Vishnu Manchu, Vedhika, Neetu Chandra Action / Romance"
neeku nenu naaku nuvvu,Raja Shekar,"Uday Kiran, Shriya Saran, Krishnam Raju, Suman",Romance,"Raja Shekar Uday Kiran, Shriya Saran, Krishnam Raju, Suman Romance"
charminar,Sagar,"Venkat, Abhirami, Prakash Raj",Romance,"Sagar Venkat, Abhirami, Prakash Raj Romance"
anaganaga o kurradu,L P Ramarao,"Rohith, Rekha Vedavyas, Rajiv Kanikala",Romance,"L P Ramarao Rohith, Rekha Vedavyas, Rajiv Kanikala Romance"
ela cheppanu,Ramana,"Tarun, Shriya Saran, Sunil",Romance,"Ramana Tarun, Shriya Saran, Sunil Romance"
simhachalam,Indra Kumar,"Srihari, Meena, Prakash Raj, Suresh, Sunil",Action,"Indra Kumar Srihari, Meena, Prakash Raj, Suresh, Sunil Action"
dongodu,Bheemineni Srinivas,"Ravi Teja, Kalyani, Rekha Vedavyas, Tanikella Bharani",Action / Comedy,"Bheemineni Srinivas Ravi Teja, Kalyani, Rekha Vedavyas, Tanikella Bharani Action / Comedy"
sambaram,K. Dasaradh,"Nitin, Nikita Thukral, Giri Babu, Seetha",Romance,"K. Dasaradh Nitin, Nikita Thukral, Giri Babu, Seetha Romance"
city,Ambati Subhash,"Mukesh Udeshi, Swapna Reddy, Vaibhavi",Action,"Ambati Subhash Mukesh Udeshi, Swapna Reddy, Vaibhavi Action"
dhum,Raju Voopati,"Jagapati Babu, Chaitanya Krishna, Neha Mehta, Sonia Agarwal",Action,"Raju Voopati Jagapati Babu, Chaitanya Krishna, Neha Mehta, Sonia Agarwal Action"
seetayya,YVS Chowdhary,"Nandamuri Harikrishna, Simran, Soundarya, Vindhiya",Action,"YVS Chowdhary Nandamuri Harikrishna, Simran, Soundarya, Vindhiya Action"
toli choopulone,Kasi Viswanath,"Kalyan Ram, Akanksha, Charanraj, Sudeepa",Romance / Action,"Kasi Viswanath Kalyan Ram, Akanksha, Charanraj, Sudeepa Romance / Action"
srirama chandrulu,Srikanth,"Rajendra Prasad, Sivaji, Raasi, Rambha, Sindhu Menon, Brahmanandam, Kovai Sarala, Venu Madhav",Comedy,"Srikanth Rajendra Prasad, Sivaji, Raasi, Rambha, Sindhu Menon, Brahmanandam, Kovai Sarala, Venu Madhav Comedy"
ori nee prema bangaram kaanu,AVS,"Rajesh Krishnan, Sangeetha, Giri Babu, Bramhanandam",Romance,"AVS Rajesh Krishnan, Sangeetha, Giri Babu, Bramhanandam Romance"
satyam,Surya Kiran,"Sumanth, Genelia D'Souza, Brahmanandam, Kota Srinivasa Rao",Romance / Action,"Surya Kiran Sumanth, Genelia D'Souza, Brahmanandam, Kota Srinivasa Rao Romance / Action"
shambhu,R. Suresh Verma,"Aryan Rajesh, Sarika, Chandra Mohan, Venu Madhav, Prakash Raj, Sanghavi",Romance,"R. Suresh Verma Aryan Rajesh, Sarika, Chandra Mohan, Venu Madhav, Prakash Raj, Sanghavi Romance"
tiger harischandraprasad,V. Samudra,"Nandamuri Harikrishna, Ramya Krishna, Sangeetha, Kota Srinivasa Rao",Action,"V. Samudra Nandamuri Harikrishna, Ramya Krishna, Sangeetha, Kota Srinivasa Rao Action"
avuna,C. Uma Maheshwar Rao,"Adarsh, Santhi Rao, Kota Srinivasa Rao",Romance,"C. Uma Maheshwar Rao Adarsh, Santhi Rao, Kota Srinivasa Rao Romance"
neeke manasichaanu,Surya Teja,"Srikanth, Charmee Kaur, Anvithaa, Brahmanandam",Romance,"Surya Teja Srikanth, Charmee Kaur, Anvithaa, Brahmanandam Romance"
maa alludu very good,E V V Satyanarayana,"Rajendra Prasad, Allari Naresh, Ramya Krishna, Mounika, Kovai Sarala",Comedy,"E V V Satyanarayana Rajendra Prasad, Allari Naresh, Ramya Krishna, Mounika, Kovai Sarala Comedy"
nee manasu naaku telusu,Jyoti Krishna,"Tarun, Trisha Krishnan, Shriya Saran, Sunil, Reema Sen, Archana Puran Singh",Romance,"Jyoti Krishna Tarun, Trisha Krishnan, Shriya Saran, Sunil, Reema Sen, Archana Puran Singh Romance"
okariki okaru,Rasool,"Srikanth, Aarti Chabria, Balayya, Tanikella Bharani",Romance,"Rasool Srikanth, Aarti Chabria, Balayya, Tanikella Bharani Romance"
missamma,Neelakanta,"Bhoomika Chawla, Sivaji, Laya, Tanikella Bharani",Drama,"Neelakanta Bhoomika Chawla, Sivaji, Laya, Tanikella Bharani Drama"
back pocket,unknown,"Vijay Sai, Sony Raj, Suman, Lavanya, Preeti Nigam, Anant, Sudarshan, Jenny, Seema, Vinod Bala",Romance,"unknown Vijay Sai, Sony Raj, Suman, Lavanya, Preeti Nigam, Anant, Sudarshan, Jenny, Seema, Vinod Bala Romance"
nenu pelliki ready,Venky,"Srikanth, Laya, Sangeetha, Anitha Hassandani",Comedy,"Venky Srikanth, Laya, Sangeetha, Anitha Hassandani Comedy"
goa,P. Kishore Kumar,"Sumit Roy, Subhash Chandra, Krishna Teja",Drama,"P. Kishore Kumar Sumit Roy, Subhash Chandra, Krishna Teja Drama"
abhimanyu,A Mallikarjun,"Kalyan Ram, Divya Spandana, Suhasini, Sowcar Janaki, Ali",Romance,"A Mallikarjun Kalyan Ram, Divya Spandana, Suhasini, Sowcar Janaki, Ali Romance"
nenu seethamahalaxmi,G Nageshwara Reddy,"Rohith, Shravya, Chalapathi Rao",Romance,"G Nageshwara Reddy Rohith, Shravya, Chalapathi Rao Romance"
veede,Ravi Raja Pinisetty,"Ravi Teja, Reema Sen, Aarti Agarwal, Shayaji Shinde",Action,"Ravi Raja Pinisetty Ravi Teja, Reema Sen, Aarti Agarwal, Shayaji Shinde Action"
shivamani,Puri Jagannadh,"Akkineni Nagarjuna, Asin Thottumkal, Rakshita, Prakash Raj",Action,"Puri Jagannadh Akkineni Nagarjuna, Asin Thottumkal, Rakshita, Prakash Raj Action"
chantigadu,Jaya,"Baladithya, Suhasini, Saranya, Brahmanandam",Romance,"Jaya Baladithya, Suhasini, Saranya, Brahmanandam Romance"
villan,K. S. Ravikumar,"Rajasekhar, Neha Dhupia, Tulip Joshi, Naresh",Thriller / Action,"K. S. Ravikumar Rajasekhar, Neha Dhupia, Tulip Joshi, Naresh Thriller / Action"
kalyana ramudu,G. Ramprasad,"Venu Thottempudi, Prabhu Deva, Nikita Thukral, Suman, Sunil",Comedy / Drama,"G. Ramprasad Venu Thottempudi, Prabhu Deva, Nikita Thukral, Suman, Sunil Comedy / Drama"
vasantham,Vikraman,"Daggubati Venkatesh, Aarti Agarwal, Kalyani, Tanikella Bharani, Sunil",Drama,"Vikraman Daggubati Venkatesh, Aarti Agarwal, Kalyani, Tanikella Bharani, Sunil Drama"
raghavendra,Suresh Krissna,"Prabhas, Shweta Agarwal, Anshu, Brahmanandam, Murali Mohan",Action,"Suresh Krissna Prabhas, Shweta Agarwal, Anshu, Brahmanandam, Murali Mohan Action"
vijayam,Singeetham Srinivasa Rao,"Raja, Gajala, Sunil, Murali Mohan",Comedy,"Singeetham Srinivasa Rao Raja, Gajala, Sunil, Murali Mohan Comedy"
jodi no.1,Pratani Ramakrishna Goud,"Uday Kiran, Venya, Srija, Kaushal",Romance,"Pratani Ramakrishna Goud Uday Kiran, Venya, Srija, Kaushal Romance"
indiramma,Ammineni Madhava Sai,"Vijayashanti, Achyuth, Vijayakumar",Social,"Ammineni Madhava Sai Vijayashanti, Achyuth, Vijayakumar Social"
golmaal,P N Ramachandra Rao,"J. D. Chakravarthy, Neha, Ramesh Arvind, Meera Vasudevan, Giri Babu, Jayaprakash, Brahmanandam",Comedy,"P N Ramachandra Rao J. D. Chakravarthy, Neha, Ramesh Arvind, Meera Vasudevan, Giri Babu, Jayaprakash, Brahmanandam Comedy"
kabaddi kabaddi,Venki,"Jagapati Babu, Kalyani, Surya, Jeeva",Comedy / Romance,"Venki Jagapati Babu, Kalyani, Surya, Jeeva Comedy / Romance"
utsaham,Allani Sridhar,"Sai Kiran, Sunitha Varma, Amar",Romance,"Allani Sridhar Sai Kiran, Sunitha Varma, Amar Romance"
gangotri,K. Raghavendra Rao,"Allu Arjun, Aditi Agarwal, Suman, Prakash Raj",Romance,"K. Raghavendra Rao Allu Arjun, Aditi Agarwal, Suman, Prakash Raj Romance"
fools,Dasari Narayana Rao,"Srinath, Gajala, Jayasudha, Kovai Sarala",Comedy / Romance,"Dasari Narayana Rao Srinath, Gajala, Jayasudha, Kovai Sarala Comedy / Romance"
juniors,J. Pulla Rao,"Allari Naresh, Sherin, Pawan, Prakash Raj",Romance,"J. Pulla Rao Allari Naresh, Sherin, Pawan, Prakash Raj Romance"
pellam oorelithe,S. V. Krishna Reddy,"Srikanth, Venu, Rakshita, Sangeetha, Brahmanandam, Sunil",Comedy,"S. V. Krishna Reddy Srikanth, Venu, Rakshita, Sangeetha, Brahmanandam, Sunil Comedy"
okkadu,Gunasekhar,"Mahesh Babu, Bhoomika Chawla, Prakash Raj, Ashish Vidyarthi",Action / Romance,"Gunasekhar Mahesh Babu, Bhoomika Chawla, Prakash Raj, Ashish Vidyarthi Action / Romance"
ee abbai chala manchodu,Agathiyan,"Ravi Teja, Sangeetha, Vani",Drama,"Agathiyan Ravi Teja, Sangeetha, Vani Drama"
evare athagadu,Bhanu Shankar,"Vallabh, Jaya Seal, Priyamani, Brahmanandam",Romance,"Bhanu Shankar Vallabh, Jaya Seal, Priyamani, Brahmanandam Romance"
naaga,D. K. Suresh,"Jr. NTR, Sadha, Jennifer, Raghuvaran, Nassar",Action,"D. K. Suresh Jr. NTR, Sadha, Jennifer, Raghuvaran, Nassar Action"
praanam,Malli,"Allari Naresh, Sadha, Seetha, M. S. Narayana, Kovai Sarala",Romance,"Malli Allari Naresh, Sadha, Seetha, M. S. Narayana, Kovai Sarala Romance"
ammayilu abbayilu,Ravi Babu,"Vijay, Mohit, Vidya, Sonu Sood, Devina, Swapna Madhuri",Romance,"Ravi Babu Vijay, Mohit, Vidya, Sonu Sood, Devina, Swapna Madhuri Romance"
hari villu,B. Narsing Rao,"Bhanuchander, Haritha, Master Sai Subhakar, Baby Nitya",Drama,"B. Narsing Rao Bhanuchander, Haritha, Master Sai Subhakar, Baby Nitya Drama"
idi maa ashokgadi love story,Suresh Krissna,"Siva Balaji, Shweta Agarwal, Kanchi Kaul",Romance,"Suresh Krissna Siva Balaji, Shweta Agarwal, Kanchi Kaul Romance"
karthik,Murali Raju,"Mukesh, Kanishka",Romance,"Murali Raju Mukesh, Kanishka Romance"
simhadri,S. S. Rajamouli,"Jr. NTR, Bhoomika Chawla, Ankitha, Nassar",Action,"S. S. Rajamouli Jr. NTR, Bhoomika Chawla, Ankitha, Nassar Action"
tarak,Bala Sekharan,"N. T. Rathnaa, Sharmili, Ali",Romance,"Bala Sekharan N. T. Rathnaa, Sharmili, Ali Romance"
donga ramudu & party,Vamsi,"Srikanth, Laya, Chandra Mohan, Kaikala Satyanarayana",Comedy,"Vamsi Srikanth, Laya, Chandra Mohan, Kaikala Satyanarayana Comedy"
oka raju oka rani,Yogi M,"Ravi Teja, Namitha, Brahmanandam, Tanikella Bharani, M. S. Narayana",Romance,"Yogi M Ravi Teja, Namitha, Brahmanandam, Tanikella Bharani, M. S. Narayana Romance"
ninne istapaddanu,Konda,"Tarun, Sridevi Vijayakumar, Anitha, Giri Babu",Romance,"Konda Tarun, Sridevi Vijayakumar, Anitha, Giri Babu Romance"
nijam,Teja,"Mahesh Babu, Rakshita, Raasi, Gopichand",Drama,"Teja Mahesh Babu, Rakshita, Raasi, Gopichand Drama"
aayudham,N. Shankar,"Rajasekhar, Sangita, Gurleen Chopra",Action,"N. Shankar Rajasekhar, Sangita, Gurleen Chopra Action"
maa babubommaki pellanta,Raviraja Pinisetty,"Aravind, Gayathri Raguram, Ajay Raghavendra, M. S. Narayana",Comedy,"Raviraja Pinisetty Aravind, Gayathri Raguram, Ajay Raghavendra, M. S. Narayana Comedy"
palnati brahmanayudu,B. Gopal,"Nandamuri Balakrishna, Sonali Bendre, Aarti Agarwal, Mukesh Rishi",Action,"B. Gopal Nandamuri Balakrishna, Sonali Bendre, Aarti Agarwal, Mukesh Rishi Action"
appudappudu,Chandra Siddhartha,"Raja, Sriya Reddy, Jayasudha, Kaikala Satyanarayana",Romance,"Chandra Siddhartha Raja, Sriya Reddy, Jayasudha, Kaikala Satyanarayana Romance"
ottesi cheputunna,E. Sathi Babu,"Srikanth, Sivaji, Sravanthi, Anitha Patel, Sunil",Comedy,"E. Sathi Babu Srikanth, Sivaji, Sravanthi, Anitha Patel, Sunil Comedy"
dhanush,Nallamothu Srinivasa Rao,"Vadde Naveen, Kiran Gill, Sivaji Raja, Brahmanandam",Action,"Nallamothu Srinivasa Rao Vadde Naveen, Kiran Gill, Sivaji Raja, Brahmanandam Action"
johnny,Pawan Kalyan,"Pawan Kalyan, Renu Desai, Raghuvaran, M. S. Narayana",Action,"Pawan Kalyan Pawan Kalyan, Renu Desai, Raghuvaran, M. S. Narayana Action"
amma nanna o tamila ammayi,Puri Jagannadh,"Ravi Teja, Asin Thottumkal, Jayasudha, Prakash Raj, Ali",Drama,"Puri Jagannadh Ravi Teja, Asin Thottumkal, Jayasudha, Prakash Raj, Ali Drama"
magic magic 3d,Jose Punnose,"Suraj Balajee, S.P. Balasubramaniam, Tirlok Malik, Pooja Kumar",Fantasy,"Jose Punnose Suraj Balajee, S.P. Balasubramaniam, Tirlok Malik, Pooja Kumar Fantasy"
aithe,Chandrashekar Yeleti,"Sashank, Sindhu Tolani, Abhishek, Mohit",Thriller,"Chandrashekar Yeleti Sashank, Sindhu Tolani, Abhishek, Mohit Thriller"
dil,V. V. Vinayak,"Nitin, Neha, Prakash Raj",Action / Romance,"V. V. Vinayak Nitin, Neha, Prakash Raj Action / Romance"
123 from amalapuram ,Varma,"Ravi Prakash, Raja Sridhar, Anil, Nithya Das, Dharmavarapu Subramanyam",Romance,"Varma Ravi Prakash, Raja Sridhar, Anil, Nithya Das, Dharmavarapu Subramanyam Romance"
okkade,Chandra Mahesh,"Srihari, Santhoshi, Mukesh Rishi",Action,"Chandra Mahesh Srihari, Santhoshi, Mukesh Rishi Action"
mogudu pellam o dongodu,Venky,"Shriya Saran, Raja, Brahmanandam",Romance / Comedy,"Venky Shriya Saran, Raja, Brahmanandam Romance / Comedy"
allari bullodu,K. Raghavendra Rao,"Nitin, Trisha Krishnan, Rathi",Romance,"K. Raghavendra Rao Nitin, Trisha Krishnan, Rathi Romance"
good boy,G Nageswara Reddy,"Rohith, Navneet Kaur",Romance,"G Nageswara Reddy Rohith, Navneet Kaur Romance"
nayakudu,Kodi Ramakrishna,"Rajasekhar, Namitha",Action,"Kodi Ramakrishna Rajasekhar, Namitha Action"
adirindayya chandram,Srinivasa Reddy,"Sivaji, Laya",Romance,"Srinivasa Reddy Sivaji, Laya Romance"
veeri veeri gummadi pandu,Nimmagadda Babu,"Ali, Sreekar Babu, Jayalalitha, Rajiv Kanakala",Romance,"Nimmagadda Babu Ali, Sreekar Babu, Jayalalitha, Rajiv Kanakala Romance"
please naaku pellaindi,Gandhi,"Raghu, Rajiv Kanakala, Sruthi Malhotra, Soni Charishma, Venu Madhav",Comedy,"Gandhi Raghu, Rajiv Kanakala, Sruthi Malhotra, Soni Charishma, Venu Madhav Comedy"
super,Puri Jagannadh,"Akkineni Nagarjuna, Sonu Sood, Anushka Shetty, Ayesha Takia",Action,"Puri Jagannadh Akkineni Nagarjuna, Sonu Sood, Anushka Shetty, Ayesha Takia Action"
nuvvante naakishtam,E. V. V. Satyanarayana,"Aryan Rajesh, Allari Naresh, Anuradha Mehta",Romance,"E. V. V. Satyanarayana Aryan Rajesh, Allari Naresh, Anuradha Mehta Romance"
athadu,Trivikram Srinivas,"Mahesh Babu, Trisha Krishnan",Action,"Trivikram Srinivas Mahesh Babu, Trisha Krishnan Action"
nikkis engagement,Rafi,"Surya, Vamsi, Rekha",Romance,"Rafi Surya, Vamsi, Rekha Romance"
premikulu,Jaya,"Yuvaraj, Rishi Girish, Kamna Jethmalani, Rajiv Kanakala, Rambabu",Romance,"Jaya Yuvaraj, Rishi Girish, Kamna Jethmalani, Rajiv Kanakala, Rambabu Romance"
rendella tarvatha,K B Anand,"Sreeram, Gopichand Lagadapati",Drama,"K B Anand Sreeram, Gopichand Lagadapati Drama"
siva,unknown,"Pradeep, Saina",Romance,"unknown Pradeep, Saina Romance"
kanchanamala cable tv,Parthasaradhi,"Srikanth, Lakshmi Rai, Raghu Babu, Brahmanandam",Comedy,"Parthasaradhi Srikanth, Lakshmi Rai, Raghu Babu, Brahmanandam Comedy"
a film by aravind,Shekkar Suri,"Rajiv Kanakala, Ghazal Srinivas, Richard Rishi, Sherlyn Chopra",Thriller,"Shekkar Suri Rajiv Kanakala, Ghazal Srinivas, Richard Rishi, Sherlyn Chopra Thriller"
political rowdy,Adi,"Mohan Babu, Charmy Kaur, Prakash Raj, Abbas",Action,"Adi Mohan Babu, Charmy Kaur, Prakash Raj, Abbas Action"
andhrudu,Paruchuri Murali,"Gopichand, Gowri Pandit, Sayaji Shinde",Romance/Action,"Paruchuri Murali Gopichand, Gowri Pandit, Sayaji Shinde Romance/Action"
chatrapathi,S. S. Rajamouli,"Prabhas, Shriya Saran, Bhanupriya",Action,"S. S. Rajamouli Prabhas, Shriya Saran, Bhanupriya Action"
jai chiranjeeva,K. Vijaya Bhaskar,"Chiranjeevi, Sameera Reddy, Bhoomika Chawla, Arbaaz Khan",Comedy,"K. Vijaya Bhaskar Chiranjeevi, Sameera Reddy, Bhoomika Chawla, Arbaaz Khan Comedy"
bhageeratha,Rasool Ellore,"Ravi Teja, Shriya Saran, Prakash Raj",Family,"Rasool Ellore Ravi Teja, Shriya Saran, Prakash Raj Family"
nireekshana,N. Seetharam,"Aryan Rajesh, Sridevi Vijayakumar, Nagendra Prasad",Romance,"N. Seetharam Aryan Rajesh, Sridevi Vijayakumar, Nagendra Prasad Romance"
gowtam ssc,P A Arun Prasad,"Navdeep, Sindhu Tolani, K. Vishwanath, Bhanupriya",Romance / Drama,"P A Arun Prasad Navdeep, Sindhu Tolani, K. Vishwanath, Bhanupriya Romance / Drama"
alex,Rajesh Touchriver,"Haranath, Rambha, Sangeetha, Shiju, Kousha, Indu Anand",Drama,"Rajesh Touchriver Haranath, Rambha, Sangeetha, Shiju, Kousha, Indu Anand Drama"
venkat tho alivelu,P Balaji,"Dilip, Sanjana, M. S. Narayana, Omkar, Anil",Romance,"P Balaji Dilip, Sanjana, M. S. Narayana, Omkar, Anil Romance"
pourusham,unknown,unknown,Action,unknown unknown Action
yuvakulu,Sai Venkat,"Kiran Tej, Sangeetha Tiwari, Abhinayasri",Romance,"Sai Venkat Kiran Tej, Sangeetha Tiwari, Abhinayasri Romance"
kaaki,Bobbili Bhanu,"Brahmaji, Gurleen Chopra",Action,"Bobbili Bhanu Brahmaji, Gurleen Chopra Action"
maha nandi,V. Samudra,"Sumanth, Srihari, Anushka Shetty",Action,"V. Samudra Sumanth, Srihari, Anushka Shetty Action"
mukha chitram,S Babu,"Srirambaji, Haripriya",Romance,"S Babu Srirambaji, Haripriya Romance"
sri,Dasaradh,"Manoj Manchu, Tamanna",Action,"Dasaradh Manoj Manchu, Tamanna Action"
vennela,Deva Kaushik,"Raja, Parvati Melton",Romance/Comedy,"Deva Kaushik Raja, Parvati Melton Romance/Comedy"
seenugadu chiranjeevi fan,Posala Radhakrishna,"Akula Vijay Vardhan, Venu Madhav, M. S. Narayana",Drama,"Posala Radhakrishna Akula Vijay Vardhan, Venu Madhav, M. S. Narayana Drama"
ayinda leda,Bharath,"Ali, Raksha, Kota Srinivasa Rao, Mallikarjuna Rao, Brahmanandam",Comedy,"Bharath Ali, Raksha, Kota Srinivasa Rao, Mallikarjuna Rao, Brahmanandam Comedy"
meenakshi,T Prabhakar,"Rajiv Kanakala, Kamalinee Mukherjee, Amit, Preethi Nigam",Romance,"T Prabhakar Rajiv Kanakala, Kamalinee Mukherjee, Amit, Preethi Nigam Romance"
abhimaani,Sana Yadi Reddy,"Nakuul Mehta, Swetha Malhotra",Romance,"Sana Yadi Reddy Nakuul Mehta, Swetha Malhotra Romance"
moguds pellams,Ranganath,"Sivaji Raja, Karthik, Rathi, Harika, Chandra Mohan, M. S. Narayana",Comedy,"Ranganath Sivaji Raja, Karthik, Rathi, Harika, Chandra Mohan, M. S. Narayana Comedy"
bhama kalapam,K.V.V. Satyanarayana,"Aditya Om, Meghna Naidu, Pooja Bharati",Romance,"K.V.V. Satyanarayana Aditya Om, Meghna Naidu, Pooja Bharati Romance"
vamsham,unknown,"Nagababu, Chandramohan, Baladitya",Family Drama,"unknown Nagababu, Chandramohan, Baladitya Family Drama"
maha simham,Akkumurthy Babu Rao,"Mukkuraju, Rallapalli, Kallu Chidambaram, Swathi, Susheela",Drama,"Akkumurthy Babu Rao Mukkuraju, Rallapalli, Kallu Chidambaram, Swathi, Susheela Drama"
allari pidugu,Jayanth C. Paranjee,"Nandamuri Balakrishna, Charmy Kaur, Katrina Kaif",Action,"Jayanth C. Paranjee Nandamuri Balakrishna, Charmy Kaur, Katrina Kaif Action"
