Title,Director,Cast,Genre,comb
badrinath,V.V. Vinayak,"Allu Arjun, Tamannaah Bhatia, Prakash Raj","Action, Drama","V.V. Vinayak Allu Arjun, Tamannaah Bhatia, Prakash Raj Action, Drama"
karalu miriyalu,Pasupuleti Venkata Rama Rao,"Navakesh, Madhu Shalini",Drama,"Pasupuleti Venkata Rama Rao Navakesh, Madhu Shalini Drama"
prema sagaram,A. Majeed,"Hasan, Shouri",Romance,"A. Majeed Hasan, Shouri Romance"
kudirithe cup coffee,Ramana Salva,"Varun Sandesh, Suma Bhattacharya",Romance,"Ramana Salva Varun Sandesh, Suma Bhattacharya Romance"
lbw life before wedding,Praveen Sattaru,"Abhijith Pundla, Asif Raj, Chinmayi Ghatrazu, Nishanthi Evani",Romance,"Praveen Sattaru Abhijith Pundla, Asif Raj, Chinmayi Ghatrazu, Nishanthi Evani Romance"
aha naa pellanta,Veera Brahmam,"Allari Naresh, Ritu Barmecha",Comedy,"Veera Brahmam Allari Naresh, Ritu Barmecha Comedy"
katha screenplay darshakatvam appalaraju,Ram Gopal Varma,"Sunil, Swati Reddy, Brahmanandam, Sakshi Gulati",Comedy,"Ram Gopal Varma Sunil, Swati Reddy, Brahmanandam, Sakshi Gulati Comedy"
vastadu naa raju,Hemant Madhukar,"Vishnu Manchu, Taapsee Pannu, Prakash Raj",Drama,"Hemant Madhukar Vishnu Manchu, Taapsee Pannu, Prakash Raj Drama"
gaganam,Radha Mohan,"Akkineni Nagarjuna, Poonam Kaur, Prakash Raj, Sana Khan",Drama,"Radha Mohan Akkineni Nagarjuna, Poonam Kaur, Prakash Raj, Sana Khan Drama"
babloo,Ravichandran Reddy,"Mano Tej, Aditi Sharma, Mukul Dev",Romance,"Ravichandran Reddy Mano Tej, Aditi Sharma, Mukul Dev Romance"
jai bolo telangana,N.Shankar,"Jagapati Babu, Sandeep, Meera Nandan, Smriti Irani, K. Chandrashekar Rao",Action,"N.Shankar Jagapati Babu, Sandeep, Meera Nandan, Smriti Irani, K. Chandrashekar Rao Action"
rakshana,Venu Pal,"Rajiv Kanakala, Karan, Parineeta",Action,"Venu Pal Rajiv Kanakala, Karan, Parineeta Action"
vaareva,Kalyan Mantena,"Vassudev Reddy, Shambhavi",Romance,"Kalyan Mantena Vassudev Reddy, Shambhavi Romance"
wanted,BVS Ravi,"Gopichand, Deeksha Seth, Jayasudha, Prakash Raj",Action,"BVS Ravi Gopichand, Deeksha Seth, Jayasudha, Prakash Raj Action"
ala modalaindi,Nandini Reddy,"Nani, Nithya Menen",Romance,"Nandini Reddy Nani, Nithya Menen Romance"
golconda high school,Mohan Krishna Indraganti,"Sumanth, Swati Reddy",Drama,"Mohan Krishna Indraganti Sumanth, Swati Reddy Drama"
anagananga oka dheerudu,Prakash Kovelamudi,"Siddharth, Shruti Haasan, Lakshmi Manchu","Fantasy, Action","Prakash Kovelamudi Siddharth, Shruti Haasan, Lakshmi Manchu Fantasy, Action"
mirapakaya,Harish Shankar,"Ravi Teja, Richa Gangopadhyay, Deeksha Seth",Romance,"Harish Shankar Ravi Teja, Richa Gangopadhyay, Deeksha Seth Romance"
parama veera chakra,Dasari Narayana Rao,"Nandamuri Balakrishna, Sheela, Amisha Patel, Neha Dhupia",Action,"Dasari Narayana Rao Nandamuri Balakrishna, Sheela, Amisha Patel, Neha Dhupia Action"
graduate,Prasad Rayala,"Akshay, Rithika Sood, Tashu Kaushik",Romance,"Prasad Rayala Akshay, Rithika Sood, Tashu Kaushik Romance"
prema kavali,Vijaya Bhaskar. K,"Aadi, Sindhu Tolani, Isha Chawla",Romance,"Vijaya Bhaskar. K Aadi, Sindhu Tolani, Isha Chawla Romance"
mangala,Osho Thulasi Ram,"Charmy Kaur, Pradeep Rawat, Subhash",Thriller Erotic,"Osho Thulasi Ram Charmy Kaur, Pradeep Rawat, Subhash Thriller Erotic"
koffee bar,Geetha Krishna,"Shashank, Bianca Desai",Drama,"Geetha Krishna Shashank, Bianca Desai Drama"
nitya pellikoduku,Alahari,"Posani Krishna Murali, Apoorva, Gowri Pandit",Romance,"Alahari Posani Krishna Murali, Apoorva, Gowri Pandit Romance"
thimmaraju,Vemagiri,"Ali, Deepthi",Comedy,"Vemagiri Ali, Deepthi Comedy"
vykuntapali,Satyadeep Reddy,"Krishnudu, Ajay, Randhir, Tashu Kaushik, Sana, Subbaraju","Comedy, Thriller","Satyadeep Reddy Krishnudu, Ajay, Randhir, Tashu Kaushik, Sana, Subbaraju Comedy, Thriller"
dussasana,Posani Krishna Murali,"Srikanth, Sanjana, Tashu Kaushik, Brahmanandam",Action,"Posani Krishna Murali Srikanth, Sanjana, Tashu Kaushik, Brahmanandam Action"
veera,Ramesh Varma,"Ravi Teja, Kajal Aggarwal, Taapsee Pannu, Manjari Phadnis, Brahmanandam",Action,"Ramesh Varma Ravi Teja, Kajal Aggarwal, Taapsee Pannu, Manjari Phadnis, Brahmanandam Action"
seema tapakai,G. Nageshwar Reddy,"Allari Naresh, Poorna",Comedy,"G. Nageshwar Reddy Allari Naresh, Poorna Comedy"
100% love,Sukumar,"Naga Chaitanya, Tamannaah Bhatia, Tara Alisha",Romance,"Sukumar Naga Chaitanya, Tamannaah Bhatia, Tara Alisha Romance"
nenu naa rakshasi,Puri Jagannath,"Rana Daggubati, Ileana D'Cruz, Abhimanyu Singh, Mumaith Khan",Romance,"Puri Jagannath Rana Daggubati, Ileana D'Cruz, Abhimanyu Singh, Mumaith Khan Romance"
mr. perfect,Dasrath,"Prabhas, Kajal Aggarwal, Taapsee Pannu, Prakash Raj, Brahmanandam",Action,"Dasrath Prabhas, Kajal Aggarwal, Taapsee Pannu, Prakash Raj, Brahmanandam Action"
maaro,Siddique,"Nitin, Meera Chopra, Abbas, Kota Srinivasa Rao",Masala,"Siddique Nitin, Meera Chopra, Abbas, Kota Srinivasa Rao Masala"
teenmaar,Jayanth C. Paranjee,"Pawan Kalyan, Trisha Krishnan, Kriti Kharbanda",Romance,"Jayanth C. Paranjee Pawan Kalyan, Trisha Krishnan, Kriti Kharbanda Romance"
lokame kothaga,Bharath Parepalli,"Shivaji, Aditi Agarwal",Romance,"Bharath Parepalli Shivaji, Aditi Agarwal Romance"
manchivadu,Deepthi,"Tanish, Bhama, K. Vishwanath, Chandramohan",Drama,"Deepthi Tanish, Bhama, K. Vishwanath, Chandramohan Drama"
shakti,Meher Ramesh,"Jr. NTR, Ileana D'Cruz, Manjari Phadnis, Jackie Shroff, Sonu Sood",Action,"Meher Ramesh Jr. NTR, Ileana D'Cruz, Manjari Phadnis, Jackie Shroff, Sonu Sood Action"
chattam,Arun Prasad P. A.,"Jagapathi Babu, Vimala Raman, Brahmanandam",Action,"Arun Prasad P. A. Jagapathi Babu, Vimala Raman, Brahmanandam Action"
raaj,V. N. Aditya,"Sumanth, Priyamani, Vimala Raman",Action,"V. N. Aditya Sumanth, Priyamani, Vimala Raman Action"
dongala mutha,"Ram Gopal Varma, Puri Jagannadh","Ravi Teja, Charmy Kaur, Prakash Raj, Lakshmi Manchu, Sunil",Suspense Thriller,"Ram Gopal Varma, Puri Jagannadh Ravi Teja, Charmy Kaur, Prakash Raj, Lakshmi Manchu, Sunil Suspense Thriller"
galli kurrolu,Sai Venkat,"Naga Varma, Shefali Sharma",Drama,"Sai Venkat Naga Varma, Shefali Sharma Drama"
people's war,R. Narayana Murthy,"R. Narayana Murthy, Srihari, Posani Krishna Murali",Social drama,"R. Narayana Murthy R. Narayana Murthy, Srihari, Posani Krishna Murali Social drama"
vennela 1 1/2,Vennela Kishore,"Chaitanya Krishna, Monal Gajjar, Vennela Kishore, Brahmanandam",Comedy,"Vennela Kishore Chaitanya Krishna, Monal Gajjar, Vennela Kishore, Brahmanandam Comedy"
avunu,Ravi Babu,"Poorna, Harshavardhan Rane, Ravi Babu",Thriller,"Ravi Babu Poorna, Harshavardhan Rane, Ravi Babu Thriller"
em babu laddu kavala,Gandhi Manohar,"Sivaji, Rachana Maurya, Aditi Agarwal, M. S. Narayana, Jeeva",Romantic thriller,"Gandhi Manohar Sivaji, Rachana Maurya, Aditi Agarwal, M. S. Narayana, Jeeva Romantic thriller"
sorry teacher,Sri Satya,"Kavya Singh, Aryaman",Romantic thriller,"Sri Satya Kavya Singh, Aryaman Romantic thriller"
sri vasavi vaibhavam,Udaya Bhaskar,"Meena, Suhasini, Suman, Sai Kiran",Drama,"Udaya Bhaskar Meena, Suhasini, Suman, Sai Kiran Drama"
routine love story,Praveen Sattaru,"Sundeep Kishan, Regina Cassandra, M. S. Narayana, Vennela Kishore",Romance,"Praveen Sattaru Sundeep Kishan, Regina Cassandra, M. S. Narayana, Vennela Kishore Romance"
mythri,Surya Raju,"Navdeep, Sadha, Brahmanandam, Uttej",Suspense thriller,"Surya Raju Navdeep, Sadha, Brahmanandam, Uttej Suspense thriller"
kittigadu,Aditya PC,"Vishal Kumar, Sai Kiran, Surekha Vani",Drama,"Aditya PC Vishal Kumar, Sai Kiran, Surekha Vani Drama"
chaduvukovali,Venkateswara Rao Maddali,"Seetha, Baby Annie, Kota Shankar Rao",Social-Drama,"Venkateswara Rao Maddali Seetha, Baby Annie, Kota Shankar Rao Social-Drama"
swati i love you,Santosh Parlawar,"Santosh Parlawar, Lasya",Romance,"Santosh Parlawar Santosh Parlawar, Lasya Romance"
yamaho yama: in america,Y. Jitender,"Sairam Shankar, Parvati Melton, Srihari, Sanjjanaa","Socio-fantasy, Comedy","Y. Jitender Sairam Shankar, Parvati Melton, Srihari, Sanjjanaa Socio-fantasy, Comedy"
midhunam,Tanikella Bharani,"S. P. Balasubrahmanyam, Lakshmi",Drama,"Tanikella Bharani S. P. Balasubrahmanyam, Lakshmi Drama"
agnatham,Sridhar Pokuru,"Kalyani, Subbaraju, Krishna Bhagavaan, Jeeva",Action,"Sridhar Pokuru Kalyani, Subbaraju, Krishna Bhagavaan, Jeeva Action"
genius,Anchor Omkar,"Havish, Sanusha, R. Sarathkumar, Abhinaya",Action,"Anchor Omkar Havish, Sanusha, R. Sarathkumar, Abhinaya Action"
onamalu,Kranthi Madhav,"Rajendra Prasad, Kalyani",Drama,"Kranthi Madhav Rajendra Prasad, Kalyani Drama"
chanakyudu,G. Srinivas,"Tanish, Ishitha, Kota Srinivasa Rao, Chandra Mohan","Drama, Romance","G. Srinivas Tanish, Ishitha, Kota Srinivasa Rao, Chandra Mohan Drama, Romance"
maa abbai engineering student,Srinivas Guttula,"Naga Siddhartha, Radhika",Romance,"Srinivas Guttula Naga Siddhartha, Radhika Romance"
veerangam,Vemuganti,"Suman, Shyamala, Ashish Vidyarthi, Kota Srinivasa Rao",Action,"Vemuganti Suman, Shyamala, Ashish Vidyarthi, Kota Srinivasa Rao Action"
yadartha prema katha,Charan Raj,"Amar, Chiri, Suman Setty, Charan Raj","Drama, Romance","Charan Raj Amar, Chiri, Suman Setty, Charan Raj Drama, Romance"
gandharvulu,Gopal G. Perumall,"Sunitha setty, Dhana, Swetha Nair","Drama, Romance","Gopal G. Perumall Sunitha setty, Dhana, Swetha Nair Drama, Romance"
20th,Ayyare,"Saagar Chandra  Rajendra Prasad, Sai Kumar, Sivaji","Drama, Romance","Ayyare Saagar Chandra  Rajendra Prasad, Sai Kumar, Sivaji Drama, Romance"
love cheste,Dhruva Nag,"Vishnu, Manjulika, Siddhi Mamre","Comedy, Romance","Dhruva Nag Vishnu, Manjulika, Siddhi Mamre Comedy, Romance"
rushi,Raj Madiraju,"Arvind Krishna, Supriya","Drama, Romance","Raj Madiraju Arvind Krishna, Supriya Drama, Romance"
shiva manasulo shruti,Thathineni Satya,"Sudheer Babu, Regina Cassandra",Romance,"Thathineni Satya Sudheer Babu, Regina Cassandra Romance"
nippu,Gunasekhar,"Ravi Teja, Deeksha Seth",Action,"Gunasekhar Ravi Teja, Deeksha Seth Action"
my heart is beating,Arun RudraKiran Meegada,"Revanth, Rajitha, Rajasekhar, Srini Kolla",Romance,"Arun RudraKiran Meegada Revanth, Rajitha, Rajasekhar, Srini Kolla Romance"
prema pilustondi,Ajay Nathani,"Balu, Sindhu Menon","Action, Romance","Ajay Nathani Balu, Sindhu Menon Action, Romance"
ee rojullo,Maruthi,"Srinivas, Reshma",Romance,"Maruthi Srinivas, Reshma Romance"
seeta weds sriram,P.S.L,"Krishna, Chandra Mohan, Uttej",Action,"P.S.L Krishna, Chandra Mohan, Uttej Action"
balaraju aadi bammardi,Rama Krishna,"Aryan Rajesh, Srihari, Shraddha Arya",Action,"Rama Krishna Aryan Rajesh, Srihari, Shraddha Arya Action"
devasthanam,Janardhana Maharshi,"K. Viswanath, S. P. Balasubrahmanyam, Aamani, Kovai Sarala",Family,"Janardhana Maharshi K. Viswanath, S. P. Balasubrahmanyam, Aamani, Kovai Sarala Family"
friendsbook,R. P. Patnaik,"Nischal, Uday, Archana Sharma, Nisha Shetty, Rao Ramesh, Chalapathi Rao",Thriller,"R. P. Patnaik Nischal, Uday, Archana Sharma, Nisha Shetty, Rao Ramesh, Chalapathi Rao Thriller"
nuvvekadunte nenakkadunta,Subha Selvam,"Uday Kiran, Shweta Basu Prasad, Brahmanandam",Romance,"Subha Selvam Uday Kiran, Shweta Basu Prasad, Brahmanandam Romance"
maa oorilo okasari emi jarigindante,Chandu,"Kuntal, Sree Siri","Comedy, Romance","Chandu Kuntal, Sree Siri Comedy, Romance"
ding dong bell,Madhusudan Reddy,"Krishnudu, Shweta Prasad, Bhanu Sri Mehra, Sumit Arora",Comedy,"Madhusudan Reddy Krishnudu, Shweta Prasad, Bhanu Sri Mehra, Sumit Arora Comedy"
break up,Amar Kamepalli,"Ranadhir Reddy, Swathi Dikshit, Suresh, Allari Subhashini, Harish",Romance,"Amar Kamepalli Ranadhir Reddy, Swathi Dikshit, Suresh, Allari Subhashini, Harish Romance"
nirbhaya bharatham,R. Narayana Murthy,"R. Narayana Murthy, Nancy Angel, Spandana, Amarendra, Arif",Crime drama,"R. Narayana Murthy R. Narayana Murthy, Nancy Angel, Spandana, Amarendra, Arif Crime drama"
naa sami ranga,Subramanyam Pachcha,"Dilip, Saikumar Pampana, SreeTeja, Yashaswini, Priyanka, Ashish Vidyarthi",Comedy,"Subramanyam Pachcha Dilip, Saikumar Pampana, SreeTeja, Yashaswini, Priyanka, Ashish Vidyarthi Comedy"
telisi teliyaka,K. Jayaprakash,"Geethanandh, Maithili, Krishna, Hasini",Romance,"K. Jayaprakash Geethanandh, Maithili, Krishna, Hasini Romance"
waiting for you,Sunil Kumar Reddy,"Sai Anil, Gayathri, Raghu Babu",Romance,"Sunil Kumar Reddy Sai Anil, Gayathri, Raghu Babu Romance"
athadu aame o scooter,Gangarapu Lakshman,"Vennela Kishore, Priyanka Chabra",Comedy,"Gangarapu Lakshman Vennela Kishore, Priyanka Chabra Comedy"
music magic,Mantraakshar D. S.,"Rahul, Trinath, Kimaya, Henna Chopra",Musical,"Mantraakshar D. S. Rahul, Trinath, Kimaya, Henna Chopra Musical"
kamina,Lakshmikanth Chenna,"Srihari, Sai Kumar, Roja, Lekha Washington, Brahmaji, Krishi Arimanda, Ashish Vidyarthi",Action/ Drama,"Lakshmikanth Chenna Srihari, Sai Kumar, Roja, Lekha Washington, Brahmaji, Krishi Arimanda, Ashish Vidyarthi Action/ Drama"
sahasra,K. Srikanth,"Rajiv Kanakala, Krishnudu, Shafi, Sri Ira, Reva",Thriller,"K. Srikanth Rajiv Kanakala, Krishnudu, Shafi, Sri Ira, Reva Thriller"
second hand,Kishore Tirumala,"Sudheer Verma, Dhanya Balakrishna, Kireeti Damaraju, Vishnu",Romantic comedy,"Kishore Tirumala Sudheer Verma, Dhanya Balakrishna, Kireeti Damaraju, Vishnu Romantic comedy"
chandee,V. Samudra,"Priyamani, R. Sarathkumar, Krishnam Raju, Vinodkumar, Nagendra Babu, Ashish Vidhyarthi, Posani Krishna Murali",Action,"V. Samudra Priyamani, R. Sarathkumar, Krishnam Raju, Vinodkumar, Nagendra Babu, Ashish Vidhyarthi, Posani Krishna Murali Action"
nenemchinna pillana?,P. Sunil Kumar Reddy,"Rahul Ravindran, Tanvi Vyas, Sanjjanaa, Suman",Romance,"P. Sunil Kumar Reddy Rahul Ravindran, Tanvi Vyas, Sanjjanaa, Suman Romance"
kaali charan,Praveen Sri,"Chaitanya, Chandini, Kavitha, Pankaj Kesari",Political drama,"Praveen Sri Chaitanya, Chandini, Kavitha, Pankaj Kesari Political drama"
entha andanga unnave,S. I. Mahendra,"Ajay Manthena, Jiyana, Kasi Viswanath, Sivanarayana",Romance,"S. I. Mahendra Ajay Manthena, Jiyana, Kasi Viswanath, Sivanarayana Romance"
ishta sakhi,Bharat Parepalli,"Varun, Bhaskar, Sriram, Anusmrithi",Romance,"Bharat Parepalli Varun, Bhaskar, Sriram, Anusmrithi Romance"
natho nenu,Rahul Singh Kagwal,Jai Akash,Drama,Rahul Singh Kagwal Jai Akash Drama
pranaya veedhullo,Prabhakar Jaini,"Dr. K. V. Ramanachari, Suresh Chandra, Vamshi Krishna, Manaswini, Sri Divya, Arjun",Romantic comedy,"Prabhakar Jaini Dr. K. V. Ramanachari, Suresh Chandra, Vamshi Krishna, Manaswini, Sri Divya, Arjun Romantic comedy"
adda,Sai Karthik,"Sushanth, Shanvi Srivastava, Raghu Babu, Kota Srinivasa Rao, Dev Gill",Action,"Sai Karthik Sushanth, Shanvi Srivastava, Raghu Babu, Kota Srinivasa Rao, Dev Gill Action"
dhoom 3,unknown,Dhoom 3,Hindi,unknown Dhoom 3 Hindi
gatham,B S Raju,"Yuvraraj Sagar, Soumya, Hema, Shwetha, Harsha, Shafir",Romance,"B S Raju Yuvraraj Sagar, Soumya, Hema, Shwetha, Harsha, Shafir Romance"
dalam,Jeevan Reddy,"Naveen Chandra, Piaa Bajpai, Abhimanyu Singh, Kishore, Nassar",Action,"Jeevan Reddy Naveen Chandra, Piaa Bajpai, Abhimanyu Singh, Kishore, Nassar Action"
uyyala jampala,Virinchi Varma,"Raj Tarun, Avika Gor, Punarnavi, Peela Gangadhar",Romance,"Virinchi Varma Raj Tarun, Avika Gor, Punarnavi, Peela Gangadhar Romance"
abbayi class ammayi mass,Koneti Srinu,"Varun Sandesh, katrina kaif, Ali",Romance,"Koneti Srinu Varun Sandesh, katrina kaif, Ali Romance"
pusthakamlo konni pageelu missing,Sajid Qureshi,"Sree, Supraja, Rahul, Satish, Masth Ali",Black comedy,"Sajid Qureshi Sree, Supraja, Rahul, Satish, Masth Ali Black comedy"
4th,Sevakudu,V. Samudra,"Srikanth, Charmy Kaur, Krishna, Manjula Swaroop","Sevakudu V. Samudra Srikanth, Charmy Kaur, Krishna, Manjula Swaroop"
bullabbai,Yuvaraju,"Krishnudu, Brahmanandam, Shravani",Romantic comedy,"Yuvaraju Krishnudu, Brahmanandam, Shravani Romantic comedy"
race,Ramesh Raparthi,"Vikram, Karthik, Bharat Kishore, Disha Pandey, Nikitha Narayanan",Romance,"Ramesh Raparthi Vikram, Karthik, Bharat Kishore, Disha Pandey, Nikitha Narayanan Romance"
mahankali,Jeevitha Rajasekhar,"Rajasekhar, Madhurima, Pradeep Rawat",Action,"Jeevitha Rajasekhar Rajasekhar, Madhurima, Pradeep Rawat Action"
backbench student,Madhura Sreedhar Reddy,"Mahat Raghavendra, Piaa Bajpai, Archana Jose Kavi",Romance,"Madhura Sreedhar Reddy Mahat Raghavendra, Piaa Bajpai, Archana Jose Kavi Romance"
rai rai,Sudhir Raju,"Sri, Aksha",Romance,"Sudhir Raju Sri, Aksha Romance"
swamy satyananda,Madan Patel,"Ravi Chetan, Neha, Anku, Madan Patel",Satire,"Madan Patel Ravi Chetan, Neha, Anku, Madan Patel Satire"
priyathama neevachata kushalama,Trinadha Rao Nakkina,"Varun Sandesh, Hasika, Komal Jha",Romance,"Trinadha Rao Nakkina Varun Sandesh, Hasika, Komal Jha Romance"
jaffa,Vennela Kishore,"Brahmanandam, Ali (actor)",Comedy,"Vennela Kishore Brahmanandam, Ali (actor) Comedy"
telugabbai,Vo Yes Avinash,"Tanish, Remya Nambeesan, Tashu Kaushik, Naga Babu, Sona Nair",Romance,"Vo Yes Avinash Tanish, Remya Nambeesan, Tashu Kaushik, Naga Babu, Sona Nair Romance"
gouravam,Radha Mohan,"Allu Sirish, Yami Gautam, Prakash Raj, Nassar",Drama/ Action,"Radha Mohan Allu Sirish, Yami Gautam, Prakash Raj, Nassar Drama/ Action"
love touch,Sri Chand,Jayanth and Dhruthi,Romance,Sri Chand Jayanth and Dhruthi Romance
chemistry,Vachespathy Jonnalagadda,"Sree Ram, Amitha Rao",Romance,"Vachespathy Jonnalagadda Sree Ram, Amitha Rao Romance"
theatre lo naluguru,Srinivasa Raju Dendukuri,"Srikanth Raghava, Dheeraj, Swetha Pandit, Varun Abhinay",Thriller,"Srinivasa Raju Dendukuri Srikanth Raghava, Dheeraj, Swetha Pandit, Varun Abhinay Thriller"
moksha,Srikanth Vemulapalli,"Meera Jasmine, Rajeev Mohan, Disha Pandey, Nassar",Horror,"Srikanth Vemulapalli Meera Jasmine, Rajeev Mohan, Disha Pandey, Nassar Horror"
oh my love,M J Reddy,"Raja, Nisha",Romance,"M J Reddy Raja, Nisha Romance"
operation dhuryodhana 2,Nandam Srinivasa Rao,"Jagapathi Babu, Posani Krishna Murali, Shayaji Shinde, Babu Mohan",Political drama,"Nandam Srinivasa Rao Jagapathi Babu, Posani Krishna Murali, Shayaji Shinde, Babu Mohan Political drama"
pelli pustakam,Ramakrishna Machakanti,"Rahul, Neethi Taylor",Romance,"Ramakrishna Machakanti Rahul, Neethi Taylor Romance"
vasool raja,Karthika Gopalakrishnan,"Navdeep, Srihari, Ritu Barmecha, Sathyam Rajesh",Drama,"Karthika Gopalakrishnan Navdeep, Srihari, Ritu Barmecha, Sathyam Rajesh Drama"
kevvu keka,Devi Prasad,"Allari Naresh, Sharmila Mandre",Action,"Devi Prasad Allari Naresh, Sharmila Mandre Action"
anukshanam,Ram Gopal Varma,"Vishnu Manchu, Navdeep, Tejaswi Madivada, Madhu Shalini, Revathi",Thriller,"Ram Gopal Varma Vishnu Manchu, Navdeep, Tejaswi Madivada, Madhu Shalini, Revathi Thriller"
aagadu,Srinu Vaitla,"Mahesh Babu, Tamannaah, Rajendra Prasad, Sonu Sood, Brahmanandam",Action / Drama,"Srinu Vaitla Mahesh Babu, Tamannaah, Rajendra Prasad, Sonu Sood, Brahmanandam Action / Drama"
loukyam,Sriwass,"Gopichand, Rakul Preet Singh, Brahmanandam",Action,"Sriwass Gopichand, Rakul Preet Singh, Brahmanandam Action"
govindudu andarivadele,Krishna Vamsi,"Ram Charan, Kajal Agarwal, Prakash Raj, Meka Srikanth, Kamalinee Mukherjee",Drama,"Krishna Vamsi Ram Charan, Kajal Agarwal, Prakash Raj, Meka Srikanth, Kamalinee Mukherjee Drama"
current theega,Nageshwara Reddy,"Manchu Manoj, Rakul Preet Singh, Jagapati Babu",Romantic comedy,"Nageshwara Reddy Manchu Manoj, Rakul Preet Singh, Jagapati Babu Romantic comedy"
dikkulu choodaku ramayya,Trikoti,"Naga Shourya, Sana Makbul, Ajay, Indraja",Romance,"Trikoti Naga Shourya, Sana Makbul, Ajay, Indraja Romance"
oka laila kosam,Vijay Kumar Konda,"Naga Chaitanya, Pooja Hegde",Romance,"Vijay Kumar Konda Naga Chaitanya, Pooja Hegde Romance"
karthikeya,Chandoo Mondeti,"Nikhil Siddharth, Swati Reddy, Tanikella Bharani, Rao Ramesh",Mystery - Thriller,"Chandoo Mondeti Nikhil Siddharth, Swati Reddy, Tanikella Bharani, Rao Ramesh Mystery - Thriller"
jai hind 2,Arjun Sarja,"Arjun Sarja, Simran Kapoor, Surveen Chawla, Rahul Dev",Action,"Arjun Sarja Arjun Sarja, Simran Kapoor, Surveen Chawla, Rahul Dev Action"
boy friend leni ammayi unda,Shiva Nagu,"Bhavani Agarwal, Mega Supreme, Kanchana Maitra",Drama,"Shiva Nagu Bhavani Agarwal, Mega Supreme, Kanchana Maitra Drama"
paathasala,Mahi V. Raghav,"Nandu, Anu, Priya, Sirisha, Sai Kiran, Shiva, Sashaank",Thriller,"Mahi V. Raghav Nandu, Anu, Priya, Sirisha, Sai Kiran, Shiva, Sashaank Thriller"
power,K. S. Ravindra,"Ravi Teja, Hansika, Regina Cassandra, Sampath Raj",Action / Drama,"K. S. Ravindra Ravi Teja, Hansika, Regina Cassandra, Sampath Raj Action / Drama"
galipatam,Naveen Gandhi,"Aadi, Erica Fernandes, Kristina Akheeva",Romance,"Naveen Gandhi Aadi, Erica Fernandes, Kristina Akheeva Romance"
ganpati bappa morya,Ramu Kumar ASK,"Srinadh, Rajasekhar, Mallesh, Riteesh",Drama,"Ramu Kumar ASK Srinadh, Rajasekhar, Mallesh, Riteesh Drama"
boochamma boochodu,Revan Yadu,"Sivaji, Kainaz Motivala, Brahmanandam, Posani Krishna Murali",Suspense Thriller,"Revan Yadu Sivaji, Kainaz Motivala, Brahmanandam, Posani Krishna Murali Suspense Thriller"
rabhasa,Santosh srinivas,"Jr.NTR, Samantha, Pranitha Subhash",Action / Drama,"Santosh srinivas Jr.NTR, Samantha, Pranitha Subhash Action / Drama"
kiraak,Harik Devabhakthuni,"Aniruddh, Chandini Tamilarasan",Romance,"Harik Devabhakthuni Aniruddh, Chandini Tamilarasan Romance"
nee jathaga nenundali,Jaya Ravindra,"Sachiin J Joshi, Nazia Hussain, Rao Ramesh",Romance,"Jaya Ravindra Sachiin J Joshi, Nazia Hussain, Rao Ramesh Romance"
lovers,Harinath,"Sumanth Ashwin, Nanditha",Romance,"Harinath Sumanth Ashwin, Nanditha Romance"
geethanjali,Raj Kiran,"Anjali, Brahmanandam, Srinivasa Reddy",Horror / Comedy,"Raj Kiran Anjali, Brahmanandam, Srinivasa Reddy Horror / Comedy"
janmasthanam,Om Sai Prakash,"Sai Kumar, Roopika, Pavani",Action / Thriller,"Om Sai Prakash Sai Kumar, Roopika, Pavani Action / Thriller"
nuvvala nenila,Trinadha Rao Nakkina,"Varun Sandesh, Poorna",Romance,"Trinadha Rao Nakkina Varun Sandesh, Poorna Romance"
brother of bommali,B. Chinni Krishna,"Allari Naresh, Karthika Nair",Comedy / Drama,"B. Chinni Krishna Allari Naresh, Karthika Nair Comedy / Drama"
chatting,T.S.Kamal,"Abhinaya Krishna, Sunitha",Romance,"T.S.Kamal Abhinaya Krishna, Sunitha Romance"
gallo telinattunde,D. Venkat Suresh,"Ajay, Kousalya",Romance,"D. Venkat Suresh Ajay, Kousalya Romance"
maaya,Neelakanta,"Harshvardhan Rane, Avanthika, Nagababu",Action / Thriller,"Neelakanta Harshvardhan Rane, Avanthika, Nagababu Action / Thriller"
raj mahal,Appaji Konda,"suryanath, sravan, jeeva, surya, tarjan, sandeepthi, ria",suspense horror,"Appaji Konda suryanath, sravan, jeeva, surya, tarjan, sandeepthi, ria suspense horror"
joru,Kumar Nagendra,"Sundeep Kishan, Rashi Khanna, Priya Banerjee",Action / Drama,"Kumar Nagendra Sundeep Kishan, Rashi Khanna, Priya Banerjee Action / Drama"
rough,C. H. Subba Reddy,"Aadi, Rakul Preet Singh, Srihari, Raghu Babu",Romance Action,"C. H. Subba Reddy Aadi, Rakul Preet Singh, Srihari, Raghu Babu Romance Action"
poga,Shankar Marthand,"Navdeep, Madhu Shalini",Horror,"Shankar Marthand Navdeep, Madhu Shalini Horror"
adavi kachina vennela,Akki Vishwanadha Reddy,"Arvind Krishna, Meenakshi Dixit, Richard Rishi, Pooja Ramachandran",Action / Drama,"Akki Vishwanadha Reddy Arvind Krishna, Meenakshi Dixit, Richard Rishi, Pooja Ramachandran Action / Drama"
unknown,Happy New Year,Farah Khan,Happy New Year,Happy New Year Farah Khan Happy New Year
15 august,Sikandar,N. Linguswamy,Anjaan,Sikandar N. Linguswamy Anjaan
20 june,Indrudu,Thiru,Naan Sigappu Manithan,Indrudu Thiru Naan Sigappu Manithan
21 march,Bhadram,unknown,Thegidi,Bhadram unknown Thegidi
14 march,Dheerudu,Boopathy Pandian,Pattathu Yaanai,Dheerudu Boopathy Pandian Pattathu Yaanai
21 february,Aaha Kalyanam,Gokul,Aaha Kalyanam,Aaha Kalyanam Gokul Aaha Kalyanam
chinnadana nee kosam,A. Karunakaran,"Nithiin, Mishti, Nassar, Naresh, Sithara, Ali",Romance,"A. Karunakaran Nithiin, Mishti, Nassar, Naresh, Sithara, Ali Romance"
mukunda,Srikanth Addala,"Varun Tej, Pooja Hegde, Prakash Raj, Rao Ramesh, Brahmanandam",Drama,"Srikanth Addala Varun Tej, Pooja Hegde, Prakash Raj, Rao Ramesh, Brahmanandam Drama"
o manishi katha,Radha Swamy Avula,"Jagapati Babu, Kalyani",Drama,"Radha Swamy Avula Jagapati Babu, Kalyani Drama"
panchabhoothalu sakshiga,Kalicharan Maadina,"Kalicharan, Manashwini, Chitram srinu, Bindu",Horror,"Kalicharan Maadina Kalicharan, Manashwini, Chitram srinu, Bindu Horror"
saheba subramanyam,Sasikiran Naryana,"Dilip Kumar, Priyanka Gor, Rao Ramesh",Romance,"Sasikiran Naryana Dilip Kumar, Priyanka Gor, Rao Ramesh Romance"
parampara,Madhu Mahankali,"Naresh, Aamani, Raavi Kondala Rao",Family drama,"Madhu Mahankali Naresh, Aamani, Raavi Kondala Rao Family drama"
ee varsham sakshiga,Ramana Mogili,"Varun Sandesh, Haripriya",Romance,"Ramana Mogili Varun Sandesh, Haripriya Romance"
the end,Rahul Sankrityan,"Yuva Chandraa, Sudhir Reddy, Gazal Somaiah, Pavani Reddy",Horror,"Rahul Sankrityan Yuva Chandraa, Sudhir Reddy, Gazal Somaiah, Pavani Reddy Horror"
lakshmi raave maa intiki,Nandyala Ravi,"Naga Shourya, Avika Gor",Romance,"Nandyala Ravi Naga Shourya, Avika Gor Romance"
chakkiligintha,Vema Reddy,"Sumanth Ashwin, Rehana",Romance,"Vema Reddy Sumanth Ashwin, Rehana Romance"
ala ela,Aneesh Krishna,"Rahul Ravindran, Bhanu Sri Mehra, Vennela Kishore, Shaani Salman, Khushi, Heebah Patel",Comedy,"Aneesh Krishna Rahul Ravindran, Bhanu Sri Mehra, Vennela Kishore, Shaani Salman, Khushi, Heebah Patel Comedy"
yamaleela 2,S. V. Krishna Reddy,"Dr.K.V.Satish, Diah Nicolas, Sadha, Mohan Babu, Brahmanandam, Nisha Kothari, Sayaji Shinde, Ali, Ashish Vidyarthi",Fantasy drama,"S. V. Krishna Reddy Dr.K.V.Satish, Diah Nicolas, Sadha, Mohan Babu, Brahmanandam, Nisha Kothari, Sayaji Shinde, Ali, Ashish Vidyarthi Fantasy drama"
33 prema kathalu,Siva Ganesh,"Vivek, Sunitha Marasiar, Sravani",Romance,"Siva Ganesh Vivek, Sunitha Marasiar, Sravani Romance"
